{
  "schema_version": "1.0",
  "corpus_id": "apt-reports-v1",
  "created_at": "2026-09-20",
  "reports": [
    {
      "report_id": "mandiant-apt1-2013",
      "title": "APT1: Exposing One of China's Cyber Espionage Units",
      "vendor": "Mandiant",
      "apt_group": "APT1",
      "publish_date": "2013-02-19",
      "language": "en",
      "url": "https://cloud.google.com/blog/topics/threat-intelligence/mandiant-exposes-apt1-chinas-cyber-espionage-units",
      "download_url": "https://services.google.com/fh/files/misc/mandiant-apt1-report.pdf",
      "local_path": "data/raw/mandiant/mandiant-apt1-2013.pdf",
      "format": "pdf",
      "file_size": 6797621,
      "sha256": "763a94ce2375210cd3a9afa88bb9c9274d67a39c49fc1fdd29bf679e4721dcdd",
      "tags": ["china", "cyber-espionage", "ioc", "malware", "ttp"]
    },
    {
      "report_id": "mandiant-apt28-2014",
      "title": "APT28: A Window into Russia's Cyber Espionage Operations?",
      "vendor": "Mandiant",
      "apt_group": "APT28 / Forest Blizzard",
      "publish_date": "2014-10-27",
      "language": "en",
      "url": "https://cloud.google.com/blog/topics/threat-intelligence/apt28-a-window-into-russias-cyber-espionage-operations",
      "download_url": "https://services.google.com/fh/files/misc/apt28-window-russia-cyber-espionage-operations.pdf",
      "local_path": "data/raw/mandiant/mandiant-apt28-2014.pdf",
      "format": "pdf",
      "file_size": 11041291,
      "sha256": "e303a5dc6135a1f658cc8a9a76abb95abe41d1e103813de70760f5d7975835d8",
      "tags": ["russia", "cyber-espionage", "ioc", "malware", "ttp"]
    },
    {
      "report_id": "mandiant-apt38-2018",
      "title": "APT38: Un-usual Suspects",
      "vendor": "Mandiant",
      "apt_group": "APT38 / Lazarus Group",
      "publish_date": "2018-10-03",
      "language": "en",
      "url": "https://cloud.google.com/blog/topics/threat-intelligence/apt38-details-on-new-north-korean-regime-backed-threat-group/",
      "download_url": "https://services.google.com/fh/files/misc/apt38-un-usual-suspects.pdf",
      "local_path": "data/raw/mandiant/mandiant-apt38-2018.pdf",
      "format": "pdf",
      "file_size": 3053657,
      "sha256": "b64603759c0a96721c69ba2083770a2a3baec1535a7f4f5ec08ef353d986ed71",
      "tags": ["north-korea", "financial-theft", "malware", "destructive-attack", "ttp"]
    },
    {
      "report_id": "mandiant-apt41-2019",
      "title": "APT41: A Dual Espionage and Cyber Crime Operation",
      "vendor": "Mandiant",
      "apt_group": "APT41 / Double Dragon",
      "publish_date": "2019-08-07",
      "language": "en",
      "url": "https://cloud.google.com/blog/topics/threat-intelligence/apt41-dual-espionage-and-cyber-crime-operation",
      "download_url": "https://services.google.com/fh/files/misc/apt41-a-dual-espionage-and-cyber-crime-operation.pdf",
      "local_path": "data/raw/mandiant/mandiant-apt41-2019.pdf",
      "format": "pdf",
      "file_size": 11385842,
      "sha256": "a147427b39c68b537bb1552e0f1274c3053268581e5b34aa9c831d2d593757e3",
      "tags": ["china", "cyber-espionage", "cyber-crime", "supply-chain", "ttp"]
    },
    {
      "report_id": "mandiant-apt42-2022",
      "title": "APT42: Crooked Charms, Cons, and Compromises",
      "vendor": "Mandiant",
      "apt_group": "APT42 / Charming Kitten",
      "publish_date": "2022-09-06",
      "language": "en",
      "url": "https://cloud.google.com/blog/topics/threat-intelligence/apt42-charms-cons-compromises",
      "download_url": "https://services.google.com/fh/files/misc/apt42-crooked-charms-cons-and-compromises.pdf",
      "local_path": "data/raw/mandiant/mandiant-apt42-2022.pdf",
      "format": "pdf",
      "file_size": 2620505,
      "sha256": "5b5537dbec2c7f64af3f8cadb3c6a69b83e9a3ad8f37bedf177c9f28033cff33",
      "tags": ["iran", "cyber-espionage", "phishing", "social-engineering", "ttp"]
    },
    {
      "report_id": "mandiant-apt44-2024",
      "title": "APT44: Unearthing Sandworm",
      "vendor": "Mandiant",
      "apt_group": "APT44 / Sandworm",
      "publish_date": "2024-04-17",
      "language": "en",
      "url": "https://cloud.google.com/blog/topics/threat-intelligence/apt44-unearthing-sandworm",
      "download_url": "https://services.google.com/fh/files/misc/apt44-unearthing-sandworm.pdf",
      "local_path": "data/raw/mandiant/mandiant-apt44-2024.pdf",
      "format": "pdf",
      "file_size": 1639506,
      "sha256": "efa07dc1a453623b70ec432b55bd7e2a61e23331a1d0cd95c7e8c20706166863",
      "tags": ["russia", "ukraine", "destructive-attack", "critical-infrastructure", "ttp"]
    },
    {
      "report_id": "cisa-aa20-283a",
      "title": "APT Actors Chaining Vulnerabilities Against SLTT, Critical Infrastructure, and Elections Organizations",
      "vendor": "CISA",
      "apt_group": "Unspecified APT actors",
      "publish_date": "2020-10-09",
      "language": "en",
      "url": "https://www.cisa.gov/news-events/cybersecurity-advisories/aa20-283a",
      "download_url": "https://www.cisa.gov/sites/default/files/publications/AA20-283A-APT_Actors_Chaining_Vulnerabilities.pdf",
      "local_path": "data/raw/cisa/cisa-aa20-283a.pdf",
      "format": "pdf",
      "file_size": 407336,
      "sha256": "a7e6fd0881e10d25d983580c4080d4b9474fa53966769718a2526d9c5d524f09",
      "tags": ["vulnerability-exploitation", "critical-infrastructure", "elections", "ioc", "ttp"]
    },
    {
      "report_id": "cisa-aa21-116a",
      "title": "Russian Foreign Intelligence Service (SVR) Cyber Operations: Trends and Best Practices for Network Defenders",
      "vendor": "CISA",
      "apt_group": "APT29 / Cozy Bear",
      "publish_date": "2021-04-26",
      "language": "en",
      "url": "https://www.cisa.gov/news-events/cybersecurity-advisories/aa21-116a",
      "download_url": "https://www.cisa.gov/sites/default/files/publications/AA21-116A_Russian_Foreign_Intelligence_Service_Cyber_Operations_508C.pdf",
      "local_path": "data/raw/cisa/cisa-aa21-116a.pdf",
      "format": "pdf",
      "file_size": 1285201,
      "sha256": "666225ebbc4ffe8feab83e2491426aa98d2fe7204d02f28721e4c4294838c49e",
      "tags": ["russia", "cyber-espionage", "password-spraying", "vulnerability-exploitation", "ttp"]
    },
    {
      "report_id": "cisa-aa21-200a",
      "title": "Tactics, Techniques, and Procedures of Indicted APT40 Actors Associated with China's MSS Hainan State Security Department",
      "vendor": "CISA",
      "apt_group": "APT40 / Leviathan",
      "publish_date": "2021-07-19",
      "language": "en",
      "url": "https://www.cisa.gov/news-events/cybersecurity-advisories/aa21-200a",
      "download_url": "https://www.cisa.gov/sites/default/files/publications/CSA_TTPs-of-Indicted-APT40-Actors-Associated-with-China-MSS-Hainan-State-Security-Department.pdf",
      "local_path": "data/raw/cisa/cisa-aa21-200a.pdf",
      "format": "pdf",
      "file_size": 1171191,
      "sha256": "160796542b39ab422f12128972583f4ae453a4a3003bd8d7bae37bc835468933",
      "tags": ["china", "cyber-espionage", "vulnerability-exploitation", "ioc", "ttp"]
    },
    {
      "report_id": "cisa-aa22-110a",
      "title": "Russian State-Sponsored and Criminal Cyber Threats to Critical Infrastructure",
      "vendor": "CISA",
      "apt_group": "Russian state-sponsored actors",
      "publish_date": "2022-04-20",
      "language": "en",
      "url": "https://www.cisa.gov/news-events/cybersecurity-advisories/aa22-110a",
      "download_url": "https://www.cisa.gov/sites/default/files/publications/AA22-110A_Joint_CSA_Russian_State-Sponsored_and_Criminal_Cyber_Threats_to_Critical_Infrastructure_4_20_22_Final.pdf",
      "local_path": "data/raw/cisa/cisa-aa22-110a.pdf",
      "format": "pdf",
      "file_size": 825968,
      "sha256": "22dfd2039010b569286026c386362d25058c4e20a09710db44d7e357d4e1a69a",
      "tags": ["russia", "critical-infrastructure", "cyber-espionage", "destructive-attack", "ttp"]
    },
    {
      "report_id": "cisa-aa23-108",
      "title": "APT28 Exploits Known Vulnerability to Carry Out Reconnaissance and Deploy Malware on Cisco Routers",
      "vendor": "CISA",
      "apt_group": "APT28 / Forest Blizzard",
      "publish_date": "2023-04-18",
      "language": "en",
      "url": "https://www.cisa.gov/news-events/cybersecurity-advisories/aa23-108",
      "download_url": "https://www.cisa.gov/sites/default/files/2023-04/apt28-exploits-known-vulnerability-to-carry-out-reconnaissance-and-deploy-malware-on-cisco-routers.pdf",
      "local_path": "data/raw/cisa/cisa-aa23-108.pdf",
      "format": "pdf",
      "file_size": 375045,
      "sha256": "c3c4ea48cef9583c1a391f4b70c4d3939324b0089158ef8d251d9afb4d559c84",
      "tags": ["russia", "router", "vulnerability-exploitation", "malware", "ttp"]
    },
    {
      "report_id": "cisa-aa23-129a",
      "title": "Hunting Russian Intelligence Snake Malware",
      "vendor": "CISA",
      "apt_group": "Turla / Snake",
      "publish_date": "2023-05-09",
      "language": "en",
      "url": "https://www.cisa.gov/news-events/cybersecurity-advisories/aa23-129a",
      "download_url": "https://www.cisa.gov/sites/default/files/2023-05/aa23-129a_snake_malware_2.pdf",
      "local_path": "data/raw/cisa/cisa-aa23-129a.pdf",
      "format": "pdf",
      "file_size": 4309123,
      "sha256": "99af77a9d4b6384b2d8df7fbf6381a950026b45d93c97c04543dedcd03ad0b7b",
      "tags": ["russia", "cyber-espionage", "malware", "network-protocol", "ioc"]
    },
    {
      "report_id": "cisa-aa23-347a",
      "title": "Russian Foreign Intelligence Service (SVR) Exploiting JetBrains TeamCity CVE Globally",
      "vendor": "CISA",
      "apt_group": "APT29 / Cozy Bear",
      "publish_date": "2023-12-13",
      "language": "en",
      "url": "https://www.cisa.gov/news-events/cybersecurity-advisories/aa23-347a",
      "download_url": "https://www.cisa.gov/sites/default/files/2023-12/aa23-347a-russian-foreign-intelligence-service-svr-exploiting-jetbrains-teamcity-cve-globally_0.pdf",